{
  "id": "soloby",
  "name": "Soloby",
  "canonical_url": "http://www.soloby.ru",
  "engine_ref": "base_http_message",
  "classification": {
    "primary": "social",
    "identity_type": "virtual_social",
    "geo_region": "global",
    "user_scale": 0,
    "tags": [
      "by",
      "ru"
    ]
  },
  "rankings": {},
  "check": {
    "probe_url": "http://www.soloby.ru/user/{username}",
    "known_accounts": [
      "red"
    ],
    "known_unclaimed": [
      "noonewouldeverusethis7"
    ],
    "headers": {},
    "presence_strs": [],
    "absence_strs": [
      "Страница не найдена"
    ]
  },
  "nsfw": false,
  "deprecated": true,
  "source": "maigret_migration",
  "last_updated": "2026-05-05T03:44:12.818398+00:00"
}