{
  "id": "kerch_forum",
  "name": "Kerch Forum",
  "canonical_url": "http://forum.kerch.com.ru",
  "engine_ref": "base_http_message",
  "classification": {
    "primary": "forum",
    "identity_type": "anonymous",
    "geo_region": "global",
    "user_scale": 0,
    "tags": [
      "forum",
      "ru",
      "ua"
    ]
  },
  "rankings": {},
  "check": {
    "probe_url": "http://forum.kerch.com.ru/search/?q={username}",
    "known_accounts": [
      "Milla"
    ],
    "known_unclaimed": [
      "noonewouldeverusethis7"
    ],
    "headers": {},
    "presence_strs": [],
    "absence_strs": [
      "По вашему запросу ничего не найдено. Попробуйте расширить критерии поиска."
    ]
  },
  "nsfw": false,
  "deprecated": true,
  "source": "maigret_migration",
  "last_updated": "2026-05-05T03:44:12.226160+00:00"
}