{
  "id": "airnfts",
  "name": "AirNFTs",
  "canonical_url": "https://app.airnfts.com",
  "engine_ref": "base_http_message",
  "classification": {
    "primary": "social",
    "identity_type": "virtual_social",
    "geo_region": "global",
    "user_scale": 0,
    "tags": [
      "crypto",
      "nft"
    ]
  },
  "rankings": {},
  "check": {
    "probe_url": "https://app.airnfts.com/creators/{username}",
    "known_accounts": [
      "demo"
    ],
    "known_unclaimed": [
      "noonewouldeverusethis7"
    ],
    "headers": {},
    "presence_strs": [
      "accountCreatedAt"
    ],
    "absence_strs": []
  },
  "nsfw": false,
  "deprecated": false,
  "source": "maigret_migration",
  "last_updated": "2026-05-05T03:44:13.582004+00:00"
}