{
  "id": "hometheaterforum",
  "name": "Hometheaterforum",
  "canonical_url": "https://www.hometheaterforum.com",
  "engine_ref": "base_http_message",
  "classification": {
    "primary": "forum",
    "identity_type": "anonymous",
    "geo_region": "global",
    "user_scale": 999926836,
    "tags": [
      "forum",
      "us"
    ]
  },
  "rankings": {
    "alexa": 73164
  },
  "check": {
    "probe_url": "https://www.hometheaterforum.com/community/members/?username={username}",
    "known_accounts": [
      "adam"
    ],
    "known_unclaimed": [
      "noonewouldeverusethis7"
    ],
    "headers": {},
    "presence_strs": [],
    "absence_strs": [
      "The specified member cannot be found"
    ]
  },
  "nsfw": false,
  "deprecated": true,
  "source": "maigret_migration",
  "last_updated": "2026-05-05T03:44:11.831659+00:00"
}