{
  "id": "bgforum",
  "name": "Bgforum",
  "canonical_url": "https://bgforum.ru",
  "engine_ref": "base_http_message",
  "classification": {
    "primary": "forum",
    "identity_type": "anonymous",
    "geo_region": "global",
    "user_scale": 0,
    "tags": [
      "forum",
      "ru"
    ]
  },
  "rankings": {},
  "check": {
    "probe_url": "https://bgforum.ru/user/{username}/",
    "known_accounts": [
      "Shark"
    ],
    "known_unclaimed": [
      "noonewouldeverusethis7"
    ],
    "headers": {},
    "presence_strs": [],
    "absence_strs": [
      "Ошибка / Пользователя с таким именем не существует"
    ]
  },
  "nsfw": false,
  "deprecated": false,
  "source": "maigret_migration",
  "last_updated": "2026-05-05T03:44:12.509833+00:00"
}