{
  "id": "forums_gearboxsoftware_com",
  "name": "forums.gearboxsoftware.com",
  "canonical_url": "https://forums.gearboxsoftware.com/u/{username}",
  "engine_ref": "base_http_status",
  "classification": {
    "primary": "social",
    "identity_type": "virtual_social",
    "geo_region": "global",
    "user_scale": 0,
    "tags": []
  },
  "rankings": {},
  "check": {
    "probe_url": "https://forums.gearboxsoftware.com/u/{username}",
    "known_accounts": [
      "adam"
    ],
    "known_unclaimed": [
      "noonewouldeverusethis7"
    ],
    "headers": {}
  },
  "nsfw": false,
  "deprecated": true,
  "source": "maigret_migration",
  "last_updated": "2026-05-05T03:44:13.368517+00:00"
}