{
  "id": "python_su",
  "name": "python.su",
  "canonical_url": "https://python.su/",
  "engine_ref": "base_http_status",
  "classification": {
    "primary": "social",
    "identity_type": "virtual_social",
    "geo_region": "global",
    "user_scale": 0,
    "tags": [
      "ru"
    ]
  },
  "rankings": {},
  "check": {
    "probe_url": "https://python.su/forum/user/{username}",
    "known_accounts": [
      "AlexaPan"
    ],
    "known_unclaimed": [
      "noonewouldeverusethis7"
    ],
    "headers": {}
  },
  "nsfw": false,
  "deprecated": false,
  "source": "maigret_migration",
  "last_updated": "2026-05-05T03:44:12.958257+00:00"
}