{
  "id": "vezha",
  "name": "Vezha",
  "canonical_url": "https://vezha.com/",
  "engine_ref": "base_http_message",
  "classification": {
    "primary": "social",
    "identity_type": "virtual_social",
    "geo_region": "global",
    "user_scale": 999080390,
    "tags": [
      "ru"
    ]
  },
  "rankings": {
    "alexa": 919610
  },
  "check": {
    "probe_url": "https://vezha.com/members/?username={username}",
    "known_accounts": [
      "red"
    ],
    "known_unclaimed": [
      "noonewouldeverusethis7"
    ],
    "headers": {},
    "presence_strs": [],
    "absence_strs": [
      "Пользователь не зарегистрирован"
    ]
  },
  "nsfw": false,
  "deprecated": false,
  "source": "maigret_migration",
  "last_updated": "2026-05-05T03:44:12.440265+00:00"
}