{
  "id": "marshmallow",
  "name": "Marshmallow",
  "canonical_url": "https://marshmallow-qa.com/{username}",
  "engine_ref": "base_http_message",
  "classification": {
    "primary": "social",
    "identity_type": "virtual_social",
    "geo_region": "global",
    "user_scale": 0,
    "tags": []
  },
  "rankings": {},
  "check": {
    "probe_url": "https://marshmallow-qa.com/{username}",
    "known_accounts": [
      "uehkon89"
    ],
    "known_unclaimed": [
      "noonewouldeverusethis7"
    ],
    "headers": {},
    "presence_strs": [
      "さんにメッセージをおくる"
    ],
    "absence_strs": [
      "ご指定のページは見つかりませんでした"
    ]
  },
  "nsfw": false,
  "deprecated": false,
  "source": "maigret_migration",
  "last_updated": "2026-05-05T03:44:12.705161+00:00"
}