{
  "id": "babyblog_ru",
  "name": "BabyBlog.ru",
  "canonical_url": "https://www.babyblog.ru/",
  "engine_ref": "base_http_status",
  "classification": {
    "primary": "social",
    "identity_type": "virtual_social",
    "geo_region": "global",
    "user_scale": 999960626,
    "tags": [
      "ru"
    ]
  },
  "rankings": {
    "alexa": 39374
  },
  "check": {
    "probe_url": "https://www.babyblog.ru/user/{username}",
    "known_accounts": [
      "blue"
    ],
    "known_unclaimed": [
      "noonewouldeverusethis"
    ],
    "headers": {}
  },
  "nsfw": false,
  "deprecated": false,
  "source": "maigret_migration",
  "last_updated": "2026-05-05T03:44:11.716216+00:00"
}