{
  "id": "cssbattle",
  "name": "CSSBattle",
  "canonical_url": "https://cssbattle.dev",
  "engine_ref": "base_http_message",
  "classification": {
    "primary": "devtools",
    "identity_type": "professional",
    "geo_region": "global",
    "user_scale": 999664810,
    "tags": [
      "coding",
      "de"
    ]
  },
  "rankings": {
    "alexa": 335190
  },
  "check": {
    "probe_url": "https://cssbattle.dev/player/{username}",
    "known_accounts": [
      "beo"
    ],
    "known_unclaimed": [
      "noonewouldeverusethis7"
    ],
    "headers": {},
    "presence_strs": [
      "\"player\":{\"id\""
    ],
    "absence_strs": [
      "\"player\":null"
    ]
  },
  "nsfw": false,
  "deprecated": false,
  "source": "maigret_migration",
  "last_updated": "2026-05-05T03:44:12.133329+00:00"
}