{
  "id": "dublikat",
  "name": "Dublikat",
  "canonical_url": "https://www.dublikat.shop",
  "engine_ref": "base_http_message",
  "classification": {
    "primary": "social",
    "identity_type": "virtual_social",
    "geo_region": "global",
    "user_scale": 0,
    "tags": [
      "ru"
    ]
  },
  "rankings": {},
  "check": {
    "probe_url": "https://my.dublikat.pro/members/?username={username}",
    "known_accounts": [
      "adam"
    ],
    "known_unclaimed": [
      "noonewouldeverusethis777"
    ],
    "headers": {},
    "presence_strs": [],
    "absence_strs": [
      "Указанный пользователь не найден."
    ]
  },
  "nsfw": false,
  "deprecated": true,
  "source": "maigret_migration",
  "last_updated": "2026-05-05T03:44:12.564856+00:00"
}