{
  "id": "redbubble",
  "name": "Redbubble",
  "canonical_url": "https://www.redbubble.com/",
  "engine_ref": "base_http_status",
  "classification": {
    "primary": "social",
    "identity_type": "virtual_social",
    "geo_region": "global",
    "user_scale": 999998492,
    "tags": [
      "shopping"
    ]
  },
  "rankings": {
    "alexa": 1508
  },
  "check": {
    "probe_url": "https://www.redbubble.com/people/{username}",
    "known_accounts": [
      "blue"
    ],
    "known_unclaimed": [
      "noonewouldeverusethis77777"
    ],
    "headers": {}
  },
  "nsfw": false,
  "deprecated": true,
  "source": "maigret_migration",
  "last_updated": "2026-05-05T03:44:10.851601+00:00"
}