{
  "id": "autolada",
  "name": "Autolada",
  "canonical_url": "https://www.autolada.ru/",
  "engine_ref": "base_http_message",
  "classification": {
    "primary": "social",
    "identity_type": "virtual_social",
    "geo_region": "global",
    "user_scale": 999631242,
    "tags": [
      "ru"
    ]
  },
  "rankings": {
    "alexa": 368758
  },
  "check": {
    "probe_url": "https://www.autolada.ru/profile.php?mode=viewprofile&u={username}",
    "known_accounts": [
      "adam"
    ],
    "known_unclaimed": [
      "noonewouldeverusethis7"
    ],
    "headers": {},
    "presence_strs": [
      "postdetails"
    ],
    "absence_strs": [
      "<title> :: AUTOLADA.RU"
    ]
  },
  "nsfw": false,
  "deprecated": false,
  "source": "maigret_migration",
  "last_updated": "2026-05-05T03:44:12.169284+00:00"
}