{
  "id": "vsemayki",
  "name": "Vsemayki",
  "canonical_url": "https://www.vsemayki.ru/",
  "engine_ref": "base_http_message",
  "classification": {
    "primary": "social",
    "identity_type": "virtual_social",
    "geo_region": "global",
    "user_scale": 999852443,
    "tags": [
      "ru"
    ]
  },
  "rankings": {
    "alexa": 147557
  },
  "check": {
    "probe_url": "https://www.vsemayki.ru/designer/{username}",
    "known_accounts": [
      "alex"
    ],
    "known_unclaimed": [
      "noonewouldeverusethis77777"
    ],
    "headers": {},
    "presence_strs": [],
    "absence_strs": [
      "404 Not Found"
    ]
  },
  "nsfw": false,
  "deprecated": false,
  "source": "maigret_migration",
  "last_updated": "2026-05-05T03:44:11.937182+00:00"
}