{
  "id": "otzovik",
  "name": "Otzovik",
  "canonical_url": "https://otzovik.com/",
  "engine_ref": "base_http_status",
  "classification": {
    "primary": "social",
    "identity_type": "virtual_social",
    "geo_region": "global",
    "user_scale": 999987873,
    "tags": [
      "ru"
    ]
  },
  "rankings": {
    "alexa": 12127
  },
  "check": {
    "probe_url": "https://otzovik.com/profile/{username}",
    "known_accounts": [
      "blue"
    ],
    "known_unclaimed": [
      "noonewouldeverusethis7"
    ],
    "headers": {}
  },
  "nsfw": false,
  "deprecated": false,
  "source": "maigret_migration",
  "last_updated": "2026-05-05T03:44:11.510498+00:00"
}