{
  "id": "arduino",
  "name": "Arduino",
  "canonical_url": "https://projecthub.arduino.cc/{username}",
  "engine_ref": "base_http_message",
  "classification": {
    "primary": "social",
    "identity_type": "virtual_social",
    "geo_region": "global",
    "user_scale": 0,
    "tags": []
  },
  "rankings": {},
  "check": {
    "probe_url": "https://projecthub.arduino.cc/{username}",
    "known_accounts": [
      "uehkon"
    ],
    "known_unclaimed": [
      "noonewouldeverusethis7"
    ],
    "headers": {},
    "presence_strs": [
      " | Arduino Project Hub</title>"
    ],
    "absence_strs": [
      "\">Arduino Project Hub</title>"
    ]
  },
  "nsfw": false,
  "deprecated": false,
  "source": "maigret_migration",
  "last_updated": "2026-05-05T03:44:12.486261+00:00"
}