{
  "id": "truesteamachievements",
  "name": "Truesteamachievements",
  "canonical_url": "https://truesteamachievements.com",
  "engine_ref": "base_http_status",
  "classification": {
    "primary": "social",
    "identity_type": "virtual_social",
    "geo_region": "global",
    "user_scale": 999699809,
    "tags": [
      "az",
      "gb"
    ]
  },
  "rankings": {
    "alexa": 300191
  },
  "check": {
    "probe_url": "https://truesteamachievements.com/gamer/{username}",
    "known_accounts": [
      "adam"
    ],
    "known_unclaimed": [
      "noonewouldeverusethis7"
    ],
    "headers": {}
  },
  "nsfw": false,
  "deprecated": false,
  "source": "maigret_migration",
  "last_updated": "2026-05-05T03:44:12.120009+00:00"
}