{
  "id": "forums_opera_com",
  "name": "forums.opera.com",
  "canonical_url": "https://forums.opera.com/",
  "engine_ref": "base_http_status",
  "classification": {
    "primary": "forum",
    "identity_type": "anonymous",
    "geo_region": "global",
    "user_scale": 0,
    "tags": [
      "forum"
    ]
  },
  "rankings": {},
  "check": {
    "probe_url": "https://forums.opera.com/user/{username}",
    "known_accounts": [
      "red"
    ],
    "known_unclaimed": [
      "noonewouldeverusethis7"
    ],
    "headers": {}
  },
  "nsfw": false,
  "deprecated": false,
  "source": "maigret_migration",
  "last_updated": "2026-05-05T03:44:10.666617+00:00"
}